source,issue,openAI_PS1,openAI_PS2,openAI_PS3,y'1,y'2,y'3,y_PS,y''_PS,ACC_AI_PS
deeplearning4j,Has anyone encountered/resolved this error while building nd4j on Windows 7? [ERROR] Failed to execute goal on project nd4j-buffer: Could not resolve dependencies for project org.nd4j:nd4j-buffer:jar:0.7.3-SNAPSHOT: Could not find artifact,"The sentence """""" Could not resolve dependencies for project org.nd4j:nd4j-buffer:jar:0.7.3-SNAPSHOT: Could not find artifact """""" uses <pattern>Could not resolve dependencies for JJ JJ:NN:NN:CD-JJ:NN:NN</pattern> to indicate the error or undesired behavior of ""Could not resolve dependencies for project org.nd4j:nd4j-buffer:jar:0.7.3-SNAPSHOT"". The answer is YES.",No sentences found to indicate the error or undesired behavior. The answer is NO.,"The sentence """""" [ERROR] Failed to execute goal on project nd4j-buffer: Could not resolve dependencies for project org.nd4j:nd4j-buffer:jar:0.7.3-SNAPSHOT: Could not find artifact """""" uses <pattern>Could not resolve dependencies for project</pattern> and <pattern>Could not find artifact</pattern> to indicate that the user is encountering an error while building nd4j on Windows 7. The answer is YES.",0,1,0,0,0,1
typescript,"Soooo the first time I try to build my library, it works just fine. The second time, I get a missing types error. here's my configs any idea what could cause it? haha finally figured it out my tsconfig needed typeroots to be ""./typings/**"" and not just ""./typings"" fixed the issue, though not sure if that's the preferred way to solve it","The sentence """""" I get a missing types error. """""" uses <pattern>get a missing types error</pattern> to indicate the error or undesired behavior of ""missing types error"". The answer is YES.","The sentence """""" I get a missing types error """""" uses <pattern>get a missing types error</pattern> to indicate the error or undesired behavior of the system or code provided by the user. The answer is YES.","The sentence """""" haha finally figured it out my tsconfig needed typeroots to be ""./typings/**"" and not just ""./typings"" """""" uses <pattern>my tsconfig needed typeroots to be</pattern> to indicate that the user found a solution to the error or undesired behavior. The answer is YES.",0,0,0,0,0,1
docker,"I've got a dumb question. I was looking into how to spin up a docker container when you are already in a docker container. People were mentioning using the docker socket (I'm not all that worried about security so this is fine). Are there any good tutorials on doing this? I've only seen a couple Stackoverflow posts, and I've never done something so silly before.",No sentences found to indicate the error or undesired behavior. The answer is NO.,"The sentence """""" I've only seen a couple Stackoverflow posts """""" uses <pattern>only seen a couple JJ NNS</pattern> to indicate that the user is having trouble finding ""any good tutorials on doing this"". The answer is YES.",No sentences found to indicate the error or undesired behavior. The answer is NO.,1,0,1,1,1,1
nodejs,"Hey@nfactorialcan you help me out too? I am using express here But the above code I mentioned is different from what I typically do I am using bodyParser() in all my APIs except this one The problem here I see is that, when I use bodyParser() the above code doesn't get executed. When I disable bodyParser(), it works fine.","The sentence """"""The problem here I see is that, when I use bodyParser() the above code doesn't get executed."""""" uses <pattern>the above code doesn't get executed</pattern> to indicate that the user is experiencing an error or undesired behavior when using bodyParser(). The answer is YES.","The sentence """""" The problem here I see is that, when I use bodyParser() the above code doesn't get executed. """""" uses <pattern>the above code doesn't get executed</pattern> to indicate the error or undesired behavior of the system or code provided by the user. The answer is YES.","The sentence """""" The problem here I see is that, when I use bodyParser() the above code doesn't get executed. """""" uses <pattern>the above code doesn't get executed</pattern> to indicate that ""the above code"" is not getting executed when using bodyParser(). The answer is YES.",0,0,0,0,0,1
appium,"is it possible to check if element is gone from the page ? for example I have 2 buttons ""A"" and ""B"" and when I click on ""A"" page shows text related to this button, but this text should disappear when I click on ""B"" and I need to check if this text is gone or not. I'm using Ruby.","The sentence """""" this text should disappear when I click on ""B"" and I need to check if this text is gone or not. """""" uses <pattern>check if this text is gone</pattern> to indicate the user's expectation to determine if the text has disappeared from the page. The answer is YES.","The sentence """""" is it possible to check if element is gone from the page ? """""" uses <pattern>check if element is gone</pattern> to indicate that the user wants to check if an element is no longer present on the page. The answer is YES.","The sentence """""" I need to check if this text is gone or not. """""" uses <pattern>check if this <text> is gone or not</pattern> to indicate the user's expectation of checking if the text has disappeared from the page. The answer is YES.",0,0,0,0,0,1
ethereum,Hello I would like to build a thin client in ethereum. Is this possible ? I want to develop a mobile application that uses blockchain for trading. Having block chain on mobile is referred to as thin client. So I would really appreciate some help in this respect.,No sentences found to indicate the error or undesired behavior. The answer is NO.,No sentences found to indicate the error or undesired behavior. The answer is NO.,No sentences found to indicate the error or undesired behavior. The answer is NO.,1,1,1,1,1,1
docker,"Hey !I'm having an issue, no internet inside the container :(",No sentences found to indicate the error or undesired behavior. The answer is NO.,No sentences found to indicate the error or undesired behavior. The answer is NO.,No sentences found to indicate the error or undesired behavior. The answer is NO.,1,1,1,0,1,0
appium,Hi Team .. anyone can help me how i can upgrade my appium 1.6.3 to 1.6.4? in Mac npm uninstall appiumand thennpm -g install appiumis this fine ?,No sentences found to indicate the error or undesired behavior. The answer is NO.,No sentences found to indicate the error or undesired behavior. The answer is NO.,No sentences found to indicate the error or undesired behavior. The answer is NO.,1,1,1,1,1,1
appium,WARN AppiumDoctor ANDROID_HOME is NOT set!i am getting this error can anyone helpHave you set ANDROID_HOME path in bashrc?,No sentences found to indicate the error or undesired behavior. The answer is NO.,"The sentence """""" WARN AppiumDoctor ANDROID_HOME is NOT set! """""" uses <pattern>ANDROID_HOME is NOT set</pattern> to indicate that the user is experiencing an error because ""ANDROID_HOME is NOT set"". The answer is YES.","The sentence """""" WARN AppiumDoctor ANDROID_HOME is NOT set! """""" uses <pattern>ANDROID_HOME is NOT set</pattern> to indicate that ""ANDROID_HOME is NOT set"" is the error or undesired behavior of the system. The answer is YES.",1,0,0,0,0,1
deeplearning4j,"Hey guys, I'm getting 'Process finished with exit code 2' when I run model.fit(dataset). I can't figure out why. I'm running version 0.4-rc3.10 (dl4j and nd4j)- POM is same as dl4j-examples POM. I wasn't having this issue yesterday, and today I've tried running a snapshot of yesterday's working code, and now model.fit(dataset) is returning exit code 2 and not finishing execution.Any ideas? What is exit code 2??","The sentence """""" I'm getting 'Process finished with exit code 2' when I run model.fit(dataset). """""" uses <pattern>'Process finished with exit code 2'</pattern> to indicate the error or undesired behavior of the system. The answer is YES.","The sentence """""" I'm getting 'Process finished with exit code 2' when I run model.fit(dataset) """""" uses <pattern>Process finished with exit code</pattern> to indicate that the user is encountering an error with the exit code 2 when running the code. The answer is YES.","The sentence """""" I'm getting 'Process finished with exit code 2' when I run model.fit(dataset). I can't figure out why. """""" uses <pattern>Process finished with exit code 2</pattern> to indicate that the user is experiencing the error ""Process finished with exit code 2"" when running the code. The answer is YES.",0,0,0,0,0,1
docker,anyone know any documents related to docker setup for scaling mongodb here,No sentences found to indicate the error or undesired behavior. The answer is NO.,No sentences found to indicate the error or undesired behavior. The answer is NO.,No sentences found to indicate the error or undesired behavior. The answer is NO.,1,1,1,1,1,1
ethereum,Trying out test-net but mining not working and I am not receiving any ether from even though it keeps saying it has. Any help would be appreciated. Thanks.,No sentences found to indicate the error or undesired behavior. The answer is NO.,"The sentence """""" mining not working and I am not receiving any ether from even though it keeps saying it has """""" uses <pattern>not working</pattern> and <pattern>not receiving any</pattern> to indicate the error or undesired behavior that ""mining is not working"" and ""not receiving any ether"". The answer is YES.","The sentence """""" mining not working and I am not receiving any ether from even though it keeps saying it has """""" uses <pattern>mining not working</pattern> and <pattern>not receiving any JJ NNS from even though it keeps saying it has</pattern> to indicate that the user is experiencing issues with mining and not receiving any ether. The answer is YES.",1,0,0,0,0,1
deeplearning4j,"If I'm using NumberedFileInputSplit, is there a way to tell the model to ignore one of the columns in my csv files?",No sentences found to indicate the error or undesired behavior. The answer is NO.,No sentences found to indicate the error or undesired behavior. The answer is NO.,No sentences found to indicate the error or undesired behavior. The answer is NO.,1,1,1,1,1,1
nodejs,"What might be the reason for npm run build to not be able to find specific scripts with CICD runuser, but to work fine as root? ljharb: , package.json scripts, e.g.: ""build:android:someapp-test"": ""cross-env BUILD_ENV=someapp-test ionic cordova build android"", then trigger by npm install / npm run build:android:someapp-test running 8.x lts on ubuntu 16.04 docker","The sentence """""" What might be the reason for npm run build to not be able to find specific scripts with CICD runuser, but to work fine as root? """""" uses <pattern>not be able to find specific scripts</pattern> to indicate that the user is facing an issue where specific scripts cannot be found when running npm run build. The answer is YES.",No sentences found to indicate the error or undesired behavior. The answer is NO.,"The sentence """""" What might be the reason for npm run build to not be able to find specific scripts with CICD runuser, but to work fine as root? """""" uses <pattern>not be able to find specific scripts</pattern> to indicate that the user is experiencing an error or undesired behavior with running ""npm run build"". The answer is YES.",0,1,0,0,0,1
typescript,"hi all, regarding Typescript's module resolution, is there something similar to ""modulesDirectories"" in webpack? I'm trying to include the ""/app"" directory in my project's root, so that I can import like ""app/actions/my-action""",No sentences found to indicate the error or undesired behavior. The answer is NO.,No sentences found to indicate the error or undesired behavior. The answer is NO.,"The sentence """""" is there something similar to ""modulesDirectories"" in webpack? """""" uses <pattern>something similar to NNS IN</pattern> to indicate that the user is looking for a similar feature to ""modulesDirectories"" in webpack for Typescript's module resolution. The answer is YES.",1,1,0,1,1,1
docker,"can anyone help me with this - swarm thinks the node is pending swarm can't find the images on docker hub, even though they exist","The sentence """""" swarm thinks the node is pending swarm can't find the images on docker hub, even though they exist """""" uses <pattern>can't find the images on docker hub</pattern> to indicate that ""swarm can't find the images on docker hub"" is an undesired behavior. The answer is YES.","The sentence """""" swarm thinks the node is pending swarm can't find the images on docker hub, even though they exist """""" uses <pattern>swarm can't find the images on docker hub</pattern> to indicate that ""swarm can't find the images on docker hub"" is an undesired behavior. The answer is YES.",No sentences found to indicate the error or undesired behavior. The answer is NO.,0,0,1,0,0,1
nodejs,I have a rust interpreter running on the shell. How do I connect to it to pass the code and also read the output from it?,No sentences found to indicate the error or undesired behavior. The answer is NO.,No sentences found to indicate the error or undesired behavior. The answer is NO.,No sentences found to indicate the error or undesired behavior. The answer is NO.,1,1,1,1,1,1
nodejs,"hey, someone has experiences with Modem.Js (npm install modem) ? asmewada: thanks, my problem is that i can't received sms on my modem (huawei), but i can send sms :) i've already seen the docs and i don't found a solution :/",No sentences found to indicate the error or undesired behavior. The answer is NO.,"The sentence """""" my problem is that i can't received sms on my modem (huawei), but i can send sms :) """""" uses <pattern>can't received sms on my modem (huawei)</pattern> to indicate that the user is having trouble receiving SMS on their modem. The answer is YES.","The sentence """""" i can't received sms on my modem (huawei), but i can send sms """""" uses <pattern>can't received sms on my modem</pattern> to indicate that the user is experiencing an error in receiving SMS on their modem. The answer is YES.",1,0,0,0,0,1
typescript,I use TypeScript to prototype. It's worth it to me to update the interfaces whenever the API changes. Then the compiler can tell me where the API changes break my code.,No sentences found to indicate the error or undesired behavior. The answer is NO.,No sentences found to indicate the error or undesired behavior. The answer is NO.,No sentences found to indicate the error or undesired behavior. The answer is NO.,1,1,1,0,1,0
docker,"Question: a docker container and its host share the kernel. So what if my host has a certain kernel version, and I want to run a socket image based on a newer kernel? How would that work? /s/socket/docker",No sentences found to indicate the error or undesired behavior. The answer is NO.,No sentences found to indicate the error or undesired behavior. The answer is NO.,No sentences found to indicate the error or undesired behavior. The answer is NO.,1,1,1,1,1,1
appium,Hello Is it possible to use multiple environment variable with the same key?npm run test --url=google.com --url=vk.comIt does not work if I use unique keysurl,"The sentence """""" It does not work if I use unique keysurl """""" uses <pattern>does not work</pattern> to indicate that ""It does not work if I use unique keys"" is an undesired behavior. The answer is YES.",No sentences found to indicate the error or undesired behavior. The answer is NO.,"The sentence """""" It does not work if I use unique keysurl """""" uses <pattern>does not work</pattern> to indicate that using unique keys for multiple environment variables with the same key is causing an undesired behavior. The answer is YES.",0,1,0,0,0,1
typescript,"Hey, is there any option to validate type of index? I want to allow only numbers as indexes/keys. Gerrit0: Thanks, I needed to check noImplicitAny option as well to get error. ok",No sentences found to indicate the error or undesired behavior. The answer is NO.,No sentences found to indicate the error or undesired behavior. The answer is NO.,"The sentence """""" I want to allow only numbers as indexes/keys """""" uses <pattern>allow only NNS as NNS</pattern> to indicate the user's expectation of allowing only numbers as indexes/keys. The answer is YES.",1,1,0,1,1,1
deeplearning4j,"Hello, I'm not understanding how the InMemoryLookupTable and VocabCache I provide to ParagraphVectors Builder (through the lookupTable and vocabCache methods) are being used. Even though I provide a prebuilt lookup table and vocab, the vocabulary is being rebuilt from scratch when I run fit(). I expected the behavior to be the same as when I provide a prebuilt model using the useExistingWordVectors method, which adds the document labels to the existing vocabulary, without rebuilding it. Can someone clarify how lookupTable and vocabCache are used? I can't quite figure it out from the documentation and source code. Thanks.","The sentence """""" I expected the behavior to be the same as when I provide a prebuilt model using the useExistingWordVectors method, which adds the document labels to the existing vocabulary, without rebuilding it. """""" uses <pattern>adds the document labels to the existing vocabulary</pattern> to indicate the user's expectation. The answer is NO.","The sentence """""" Even though I provide a prebuilt lookup table and vocab, the vocabulary is being rebuilt from scratch when I run fit(). """""" uses <pattern>the vocabulary is being rebuilt from scratch</pattern> to indicate the undesired behavior of the system. The answer is YES.","The sentence """""" Even though I provide a prebuilt lookup table and vocab, the vocabulary is being rebuilt from scratch when I run fit(). """""" uses <pattern>the vocabulary is being rebuilt from scratch</pattern> to indicate the error or undesired behavior of the system or code. The answer is YES.",1,0,0,0,0,1
nodejs,@OrangeBorning Can someone help me? My post request was blocked by the browser and cancelled. There is no problem with https requesting http here. I don't quite understand why it was cancelled.,"The sentence """""" My post request was blocked by the browser and cancelled. """""" uses <pattern>was blocked by the browser and cancelled</pattern> to indicate that the user's post request was blocked and cancelled, which is an undesired behavior. The answer is YES.","The sentence """""" My post request was blocked by the browser and cancelled. """""" uses <pattern>request was blocked by the browser and cancelled</pattern> to indicate that the user's post request is being blocked and cancelled by the browser, which is an undesired behavior. The answer is YES.","The sentence """""" My post request was blocked by the browser and cancelled. """""" uses <pattern>was blocked by the browser and cancelled</pattern> to indicate an undesired behavior of the user's post request being blocked and cancelled by the browser. The answer is YES.",0,0,0,0,0,1
nodejs,"Hey guys. Can you help me with this error..? TypeError: Cannot read property 'write' of nullat Zlib.callback (zlib.js:499:33) I haven't used the zlib module explicitly in the code. I have a Node.js backend, with socket.io websocket and MongoDB database. The server crashes once every 24 hrs and logs this error.","The sentence """""" TypeError: Cannot read property 'write' of nullat Zlib.callback (zlib.js:499:33) """""" uses <pattern>TypeError: Cannot read property NN of NNat NN.NN (NN.js:NN:NN)</pattern> to indicate an error related to ""Cannot read property 'write' of null"". The answer is YES.","The sentence """""" TypeError: Cannot read property 'write' of nullat Zlib.callback (zlib.js:499:33) """""" uses <pattern>TypeError: Cannot read property 'write' of null</pattern> to indicate the error or undesired behavior of the code. The answer is YES.","The sentence """""" TypeError: Cannot read property 'write' of nullat Zlib.callback (zlib.js:499:33) """""" uses <pattern>TypeError: Cannot read property 'write' of null</pattern> to indicate the error or undesired behavior of the system or code. The answer is YES.",0,0,0,0,0,1
docker,"hi folks, what are the best metrics to consider for your container footprint in terms of memory, cpu etc how would you measure it?",No sentences found to indicate the error or undesired behavior. The answer is NO.,No sentences found to indicate the error or undesired behavior. The answer is NO.,No sentences found to indicate the error or undesired behavior. The answer is NO.,1,1,1,1,1,1
typescript,I am having a heck of a time getting my project to compile. It can't resolve the module 'child_process'. It can resolve the module with intellisense but it just won't compile. This is an electron project that is using Angular2 and Typescript. My tsconfig.json is as follows:,"The sentence """""" It can't resolve the module 'child_process'. """""" uses <pattern>can't resolve the module 'child_process'</pattern> to indicate that the user's project is having trouble resolving the module 'child_process'. The answer is YES.","The sentence """""" It can't resolve the module 'child_process'. """""" uses <pattern>can't resolve the module 'child_process'</pattern> to indicate that the user is having trouble resolving the module 'child_process'. The answer is YES.","The sentence """""" It can't resolve the module 'child_process'. """""" uses <pattern>can't resolve the module</pattern> to indicate that the user is experiencing trouble with resolving the module 'child_process'. The answer is YES.",0,0,0,0,0,1
nodejs,"Hi! I am having some troubles..I am running one server which listens on port 3333 for a post request and adds to the DB(neo4j).On post 4445 I am running another server which gets about 8000 airports and using ajax-request sending a post request with the airport dits.This is the request code: A few problems.. first the callback runs only when there is an error, and after about 4000 request the I get this error - and on port 3333 this error: any ideas?","The sentence """""" A few problems.. first the callback runs only when there is an error, and after about 4000 request the I get this error - and on port 3333 this error: """""" uses <pattern>the callback runs only when there is an error</pattern> and <pattern>after about 4000 request the I get this error</pattern> to indicate that the user is experiencing two issues: the callback only runs when there is an error and they are getting an error after about 4000 requests. The answer is YES.","The sentence """""" first the callback runs only when there is an error, and after about 4000 request the I get this error """""" uses <pattern>the callback runs only when there is an error</pattern> and <pattern>after about 4000 request the I get this error</pattern> to indicate the error or undesired behavior of the system or code provided by the user. The answer is YES.","The sentence """""" first the callback runs only when there is an error, and after about 4000 request the I get this error - and on port 3333 this error: """""" uses <pattern>the callback runs only when there is an error</pattern> and <pattern>after about NUM request</pattern> to indicate that the user is experiencing two issues: 1) the callback only runs when there is an error, and 2) after about 4000 requests, an error occurs. The answer is YES.",0,0,0,0,0,1
nodejs,"folks, are you tried webdriver latest months? I can't even reproduce the original manual examples with latest Firefox.","The sentence """""" I can't even reproduce the original manual examples with latest Firefox. """""" uses <pattern>I can't even reproduce the original manual examples with latest NNP</pattern> to indicate that the user is unable to ""reproduce the original manual examples with latest Firefox"". The answer is YES.","The sentence """""" I can't even reproduce the original manual examples with latest Firefox. """""" uses <pattern>can't reproduce the original manual examples</pattern> to indicate that the user is experiencing difficulty in reproducing the original manual examples. The answer is YES.","The sentence """""" I can't even reproduce the original manual examples with latest Firefox. """""" uses <pattern>can't even reproduce</pattern> to indicate that the user is having trouble reproducing the original manual examples with the latest Firefox. The answer is YES.",0,0,0,0,0,1
deeplearning4j,Hi Should i add the nd4j-jblas to my pom.xml file if I want GPU suport?,No sentences found to indicate the error or undesired behavior. The answer is NO.,No sentences found to indicate the error or undesired behavior. The answer is NO.,No sentences found to indicate the error or undesired behavior. The answer is NO.,1,1,1,1,1,1
docker,Hii am trying to start cassandra container and i am having a conf. file on my host system and i have to supply it to the container so that cassandra takes that conf. file.one way is that i mount a volume replace the file inside container and commit the change to container.is there any other way i can do it so that i can override the inside container conf. files,No sentences found to indicate the error or undesired behavior. The answer is NO.,No sentences found to indicate the error or undesired behavior. The answer is NO.,No sentences found to indicate the error or undesired behavior. The answer is NO.,1,1,1,1,1,1
gitter,How to link out out of python to my terminal and im using atom ?,No sentences found to indicate the error or undesired behavior. The answer is NO.,No sentences found to indicate the error or undesired behavior. The answer is NO.,No sentences found to indicate the error or undesired behavior. The answer is NO.,1,1,1,1,1,1
