source,issue,openAI_PS1,openAI_PS2,openAI_PS3,y'1,y'2,y'3,y_PS,y''_PS,ACC_AI_PS
angular,"Hi, when I am trying to apply class dynamically inside ngfor like code where i is index. it is messing up my material css i.e I am not able to find any material css on the component. button looks like plain HTML button. The same is happening with other components like input as well. I am using Angular 7. any Explanation why that was not working?","The sentence """""" it is messing up my material css i.e I am not able to find any material css on the component. button looks like plain HTML button. The same is happening with other components like input as well. """""" uses <pattern>messing up my JJ NN i.e JJ NN VB VB</pattern> to indicate that the user's expectation is not met, as the material CSS is not being applied to the components and they look like plain HTML elements. The answer is YES.","The sentence """""" it is messing up my material css i.e I am not able to find any material css on the component. button looks like plain HTML button. The same is happening with other components like input as well. """""" uses <pattern>messing up my JJ NNS i.e. I am not JJ to find any JJ NNS on DT NNS</pattern> to indicate that the user is experiencing an error where the material CSS is not being applied to the components properly. The answer is YES.","The sentence """""" it is messing up my material css i.e I am not able to find any material css on the component. button looks like plain HTML button. The same is happening with other components like input as well. """""" uses <pattern>messing up my material css</pattern> to indicate that the user is experiencing issues with the display of material CSS on the component. The answer is YES.",0,0,0,0,0,1
angular,"is it possible to get a RouteConfig matched against a route/url? I'm trying to create a Breadcrumb component and get the configs for each of the items: ""/products/wood/table"" I already have them as an array. so would like to map those URLs to matched RouteConfig (as they have data attached to each)","The sentence """""" I'm trying to create a Breadcrumb component and get the configs for each of the items: ""/products/wood/table"" I already have them as an array. """""" uses <pattern>get the configs for each of the items</pattern> to indicate the user's expectation. The answer is NO.","The sentence """""" I'm trying to create a Breadcrumb component and get the configs for each of the items: ""/products/wood/table"" I already have them as an array. so would like to map those URLs to matched RouteConfig (as they have data attached to each) """""" uses <pattern>would like to map those URLs to matched RouteConfig</pattern> to indicate that the user wants to map URLs to matched RouteConfig. The answer is YES.",No sentences found to indicate the error or undesired behavior. The answer is NO.,1,0,1,1,1,1
,I have angular running from a .Net Core server. The server won't even load the app (by design) until the user has an access token. What's the best way for the angular app to get that access token and user information?,No sentences found to indicate the error or undesired behavior. The answer is NO.,No sentences found to indicate the error or undesired behavior. The answer is NO.,No sentences found to indicate the error or undesired behavior. The answer is NO.,1,1,1,0,1,0
angular,"Hello everyone, I want to do sub menu with searh like in gitlab. i use this code for menu but i have problem in sub menu with search. how can i do that. any help please?",No sentences found to indicate the error or undesired behavior. The answer is NO.,"The sentence """""" i have problem in sub menu with search """""" uses <pattern>have problem in PP sub menu with search</pattern> to indicate that the user is experiencing an error or undesired behavior in the ""sub menu with search"". The answer is YES.",No sentences found to indicate the error or undesired behavior. The answer is NO.,1,0,1,0,1,0
angular,I'm struggling with getting this logic [code]. I wanted to set a default value to the drop down if API returns no data,"The sentence """""" I wanted to set a default value to the drop down if API returns no data """""" uses <pattern>set a default value to the drop down</pattern> and <pattern>API returns no data</pattern> to indicate that the user is struggling with getting the desired logic when the API returns no data. The answer is YES.","The sentence """""" I wanted to set a default value to the drop down if API returns no data """""" uses <pattern>if API returns no data</pattern> to indicate that the user is facing an undesired behavior when ""API returns no data"". The answer is YES.",No sentences found to indicate the error or undesired behavior. The answer is NO.,0,0,1,0,0,1
angular,In this graph I have 6 series of data but i want to show only top 5 series of data [link]. how can i achieve to display top 5 series of data?. In this graph I have 6 series of data but i want to show only top 5 series of data. Is anyone online to answer my question?,"The sentence """""" how can i achieve to display top 5 series of data? """""" uses <pattern>achieve to display JJ CD NN</pattern> and ""display top 5 series of data"" is the user's expectation rather than indicating an error or undesired behavior, so the answer is NO.","The sentence """""" how can i achieve to display top 5 series of data? """""" uses <pattern>display top 5 series of data</pattern> to indicate the user's expectation of showing only the top 5 series of data. The answer is YES.","The sentence """""" how can i achieve to display top 5 series of data? """""" uses <pattern>display top CD series of data</pattern> to indicate that the user wants to display only the top 5 series of data. The answer is YES.",1,0,0,0,0,1
,"Hi! I have just noticed, that `[ngSwitch]=""condition""` starts displaying the new matching element before removing the old one when `condition` changes, meaning that elements for both the previous and the current switch cases are visible for a moment (a change detection cycle most likely). Is it intended behavior? Is there a workaround?",No sentences found to indicate the error or undesired behavior. The answer is NO.,"The sentence """""" starts displaying the new matching element before removing the old one when `condition` changes """""" uses <pattern>starts displaying the new matching element before removing the old one</pattern> to indicate that the user is experiencing an undesired behavior where the elements for both the previous and current switch cases are visible for a moment. The answer is YES.","The sentence """""" starts displaying the new matching element before removing the old one when `condition` changes """""" uses <pattern>starts displaying the new JJ NN before removing the old one</pattern> to indicate the error or undesired behavior of the system. The answer is YES.",1,0,0,0,0,1
,"Hi, I'm getting below error `Element implicitly has an 'any' type because expression of type '""name1""' can't be used to index type '{}'.` Can someone help me here? TIA",No sentences found to indicate the error or undesired behavior. The answer is NO.,"The sentence """""" `Element implicitly has an 'any' type because expression of type '""name1""' can't be used to index type '{}'` """""" uses <pattern>Element implicitly has an 'any' type</pattern> to indicate the error or undesired behavior of the code. The answer is YES.","The sentence """""" `Element implicitly has an 'any' type because expression of type '""name1""' can't be used to index type '{}'.` """""" uses <pattern>error Element implicitly</pattern> to indicate that the user is experiencing an error related to indexing types. The answer is YES.",1,0,0,0,0,1
angular,What is the appropriate way of using local environments variables in Angular? I would like to import variables from local environment and use them in the Angular app. Any ideas and suggestions how to do this properly?,No sentences found to indicate the error or undesired behavior. The answer is NO.,No sentences found to indicate the error or undesired behavior. The answer is NO.,No sentences found to indicate the error or undesired behavior. The answer is NO.,1,1,1,1,1,1
angular,"hey guys, got a weird one here. I'm using ng-select in my app, but it's used hundreds of times all over the place, so to make usage consistent and to make updating all of them easier, we made a wrapper component which has the ng-select inside it. It's mostly working very well, the only problem is with projected content. So ng-select supports projected content with `ng-option` elements, so you can do, e.g. this: [code]. This would allow options in the select list to have custom span inside them. But I cannot get this working in my wrapper. The template for the wrapper looks like: [code]. And from other templates I would use it like: [code]. I would expect projected content to be passed straight through to inner `ng-select`, but it's not working at all. If I move the `ng-content` tags out of between `ng-select` then the mark-up is rendered, but ng-select cannot use it. What am I missing? Is this even possible?","The sentence """""" The only problem is with projected content. """""" uses <pattern>the only problem is with</pattern> to indicate that ""projected content"" is the error or undesired behavior. The answer is YES.","The sentence """""" The only problem is with projected content. So ng-select supports projected content with `ng-option` elements, but I cannot get this working in my wrapper. """""" uses <pattern>problem is with projected content</pattern> to indicate that the user is experiencing a problem with the projected content in their wrapper component. The answer is YES.","The sentence """""" The only problem is with projected content. """""" uses <pattern>problem is with</pattern> to indicate that ""the only problem"" is related to ""projected content"". The answer is YES.",0,0,0,0,0,1
angular,"I have built an angular 11 app with routing modules. If you start the app by going to the domain url it will do the right thing and go to the ""dashboard"" path. Once there, I can use a menu with many links to click on and the app will navigate to where it should. [link] -> brings me to 'dashboard' path. But I cannot type another path in the browser address bar that is valid (and I can get to via routerlink or code anvagation) as: [code]. What am I doing wrong?","The sentence """""" But I cannot type another path in the browser address bar that is valid (and I can get to via routerlink or code anvagation) as """""" uses <pattern>cannot type another path in the browser address bar that is valid</pattern> to indicate that the user is experiencing an undesired behavior where they are unable to navigate to a valid path via the browser address bar. The answer is YES.","The sentence """""" But I cannot type another path in the browser address bar that is valid (and I can get to via routerlink or code navigation) as: """""" uses <pattern>cannot type another path in the browser address bar that is valid</pattern> to indicate that the user is experiencing an error where they are unable to navigate to another valid path in the browser address bar. The answer is YES.","The sentence """""" But I cannot type another path in the browser address bar that is valid """""" uses <pattern>type another path in the browser address bar</pattern> to indicate that the user is unable to navigate to a valid path by typing it in the browser address bar. The answer is YES.",0,0,0,0,0,1
angular,"is it possible to animate the parent of a list when an ngFor :enter happens? currently I have a slide-in animation for when an item gets added to the top of the stack and use transform: `translateY(-100%) -> 0%` but then you have the entire list not reacting to the addition. If I use position: relative for the animation, it could be janky. if I can react on the parent/list of the items, I could start the animation with `transform: -200px -> 0` and the it'll slide the list down as well","The sentence """""" currently I have a slide-in animation for when an item gets added to the top of the stack and use transform: `translateY(-100%) -> 0%` but then you have the entire list not reacting to the addition. """""" uses <pattern>entire list not reacting to the addition</pattern> to indicate the undesired behavior of the system or code provided by the user. The answer is YES.","The sentence """""" but then you have the entire list not reacting to the addition. """""" uses <pattern>not reacting to the addition</pattern> to indicate that ""the entire list not reacting to the addition"" is an undesired behavior. The answer is YES.","The sentence """""" currently I have a slide-in animation for when an item gets added to the top of the stack and use transform: `translateY(-100%) -> 0%` but then you have the entire list not reacting to the addition. """""" uses <pattern>the entire list not reacting to the addition</pattern> to indicate the undesired behavior of the system. The answer is YES.",0,0,0,0,0,1
angular,"Hello everyone, I'm migrating from karma to jest and I need to convert: jest.spyOn(component, 'onBlur').and.callThrough(); I get this error in Jest: Property 'and' does not exist on type 'SpyInstance<void, []>'","The sentence """""" Property 'and' does not exist on type 'SpyInstance<void, []>' """""" uses <pattern>Property JJ does not exist on type NNS</pattern> indicate that ""Property 'and' does not exist on type 'SpyInstance<void, []>'"" is the error or undesired behavior. The answer is YES.","The sentence """""" Property 'and' does not exist on type 'SpyInstance<void, []>' """""" uses <pattern>Property 'and' does not exist on type 'SpyInstance<void, []>'</pattern> to indicate the error or undesired behavior of the code. The answer is YES.","The sentence """""" Property 'and' does not exist on type 'SpyInstance<void, []>' """""" uses <pattern>Property NN does not exist on type 'Type'</pattern> to indicate that the user is encountering an error with the property 'and' not existing on the type 'SpyInstance<void, []>'. The answer is YES.",0,0,0,0,0,1
,"Hello, i have update my Angular 9 Project to Angular 11 and get now this error if i want start with `npm run start`. `ERROR in Cannot read property 'kind' of undefined`. On `ng build --prod` i get more details: with typescript 4.1.5 i get again this error: `ERROR in Cannot read property 'flags' of undefined`. Like show in link below. if i change `""aot"": true` to`""aot"": false` and remove `""buildOptimizer"": true,` in angular.json then i get new error: `ERROR in No NgModule metadata found for 'AppModule'. I think the problem is custom Angular builders. Thank you for you time and help","The sentence """""" `ERROR in Cannot read property 'kind' of undefined` """""" uses <pattern>Cannot read property JJ of undefined</pattern> to indicate the error or undesired behavior of the system or code provided by the user. The answer is YES.","The sentence """""" `ERROR in Cannot read property 'kind' of undefined` """""" uses <pattern>`ERROR in Cannot read property 'kind' of undefined`</pattern> to indicate the error or undesired behavior of the system or code provided by the user. The answer is YES.","The sentence """""" i get now this error if i want start with `npm run start`. `ERROR in Cannot read property 'kind' of undefined`. """""" uses <pattern>get now this error</pattern> to indicate that the user is experiencing an error message ""Cannot read property 'kind' of undefined"" when trying to start the project with `npm run start`. The answer is YES.",0,0,0,0,0,1
angular,"I have an input and an output. However if I try to connect them, the output does not work anymore: [code]. internaly, it is: [code]. Any ideas?","The sentence """""" if I try to connect them, the output does not work anymore """""" uses <pattern>does not work anymore</pattern> to indicate that ""the output does not work"" is an undesired behavior. The answer is YES.","The sentence """""" if I try to connect them, the output does not work anymore """""" uses <pattern>the output does not work anymore</pattern> to indicate that ""the output does not work"" is an undesired behavior. The answer is YES.","The sentence """""" However if I try to connect them, the output does not work anymore """""" uses <pattern>output does not work anymore</pattern> to indicate that ""the output does not work anymore"" is an undesired behavior. The answer is YES.",0,0,0,0,0,1
angular,Hi ! i'm trying to compare between two texts and display colored text result in a simple div or textarea (i first tried using mat-dialog) but i don't get the colors in HTML in component.ts : [code]. anyone have an idea where is the problem in my code or what to should I add please ?,"The sentence """""" i don't get the colors in HTML in component.ts """""" uses <pattern>don't get the colors</pattern> to indicate that the user is facing an issue with displaying colored text in HTML. The answer is YES.","The sentence """""" i don't get the colors in HTML in component.ts """""" uses <pattern>don't get the colors</pattern> to indicate that the user is experiencing an undesired behavior of not getting the colors in the HTML. The answer is YES.","The sentence """""" i don't get the colors in HTML in component.ts """""" uses <pattern>don't get the colors in HTML</pattern> to indicate that the user is experiencing an error or undesired behavior of not getting the colors in HTML. The answer is YES.",0,0,0,0,0,1
,"Hey, why am unable to use the angular material? If i imports any material module, it gives errors everywhere on my code once i declare any of its components. Just errors everywhere","The sentence """""" If i imports any material module, it gives errors everywhere on my code once i declare any of its components. Just errors everywhere """""" uses <pattern>gives errors everywhere on my code once</pattern> to indicate that the user is experiencing errors when importing and declaring components from the Angular Material module. The answer is YES.","The sentence """""" If i imports any material module, it gives errors everywhere on my code once i declare any of its components. Just errors everywhere """""" uses <pattern>gives errors everywhere on my code</pattern> to indicate that the user is experiencing errors when using Angular Material. The answer is YES.","The sentence """""" it gives errors everywhere on my code once i declare any of its components. """""" uses <pattern>gives errors everywhere</pattern> to indicate that the user is experiencing errors when declaring Angular Material components. The answer is YES.",0,0,0,0,0,1
angular,"Hey guys, I got this error "" The pipe 'async' could not be found "" i tried everything, i check that i have the common module imported, any ideia when this error happen besides the missing common module? thanks in advance!","The sentence """""" i got this error "" The pipe 'async' could not be found "" """""" uses <pattern>The pipe '<pipe_name>' could not be found</pattern> to indicate that the error is related to the missing pipe 'async'. The answer is YES.","The sentence """""" The pipe 'async' could not be found """""" uses <pattern>could not be found</pattern> to indicate that the error is ""The pipe 'async' could not be found"". The answer is YES.","The sentence """""" i check that i have the common module imported """""" uses <pattern>check that i have</pattern> to indicate that the user is checking for a specific module being imported. The answer is NO.",0,0,1,0,0,1
angular,"There's a form in the child component, can we give a warning to the user when the form is filled but the user is try to navigate somewhere else? User is clicking on the sidenav in the parent component. A warning like this <unconvertable>.","The sentence """""" There's a form in the child component, can we give a warning to the user when the form is filled but the user is try to navigate somewhere else? """""" uses <pattern>give a warning to the user when the form is filled but the user is try to navigate somewhere else</pattern> to indicate the user's expectation. The answer is NO.",No sentences found to indicate the error or undesired behavior. The answer is NO.,"The sentence """""" There's a form in the child component, can we give a warning to the user when the form is filled but the user is try to navigate somewhere else? """""" uses <pattern>warning to the user when the form is filled but the user is try to navigate somewhere else</pattern> to indicate the user's expectation. The answer is NO.",1,1,1,1,1,1
angular,"I have a challenge that I'd like to get yalls insight. I've received much help from here and I greatly appreciate it. Thanks in advance. I am building a web app for used car dealers. In the used car dealer world, there are many many reports and forms they are required to print. Right now, I am working on the first report: Buyers Guide. The Buyers Guide has some information regarding the vehicle. The gov provides a PDF fillable form here: (no, this is not spam). I'd like to be able to fill out the form with the data from our web app and print out the PDF. I was looking for packages and found this one. The only thing is that we want to store the report somewhere, we don't want the user to have to upload it. Additionally, I guess I just don't know how to set up this package. My question: has anyone ever done this, and if so, how?","The sentence """""" The only thing is that we want to store the report somewhere, we don't want the user to have to upload it. """""" uses <pattern>want to store the report somewhere</pattern> to indicate that the user wants to store the report but doesn't want the user to have to upload it. The answer is YES.","The sentence """""" The only thing is that we want to store the report somewhere, we don't want the user to have to upload it. """""" uses <pattern>we want to store the report somewhere</pattern> to indicate that the user wants to store the report without requiring the user to upload it. The answer is YES.",No sentences found to indicate the error or undesired behavior. The answer is NO.,0,0,1,0,0,1
angular,"Hello, this isn't 100% angular question, I just need to deploy Angular app with nginx alongside and express ejs app but It seems not to work, this is my nginx config : [code].",No sentences found to indicate the error or undesired behavior. The answer is NO.,No sentences found to indicate the error or undesired behavior. The answer is NO.,No sentences found to indicate the error or undesired behavior. The answer is NO.,1,1,1,0,1,0
angular,"I have a REST endpoint that takes ages to run completely (it validates all active tickets on a user and each validation takes ~500ms) so I decided to output the result of the validation of each ticket. That works just fine, when running the request manually in Chrome I get a steady stream of objects in the browser. But now I want to retrieve that data in our Angular application. Any idea how I can do that? HttpClient doesn't seem to support streaming data from the server.","The sentence """""" HttpClient doesn't seem to support streaming data from the server. """""" uses <pattern>doesn't seem to support VBG NN from the server</pattern> to indicate that the user is experiencing an error or undesired behavior of HttpClient not supporting streaming data from the server. The answer is YES.","The sentence """""" HttpClient doesn't seem to support streaming data from the server. """""" uses <pattern>seem to support streaming data</pattern> to indicate that the user is experiencing an error or undesired behavior where ""HttpClient"" does not support streaming data from the server. The answer is YES.","The sentence """""" HttpClient doesn't seem to support streaming data from the server. """""" uses <pattern>doesn't seem to support VB gerund NP</pattern> to indicate that ""HttpClient doesn't support streaming data from the server"" is an undesired behavior. The answer is YES.",0,0,0,0,0,1
angular,"I have xml with href to xsl from backend , how can i display this in browser [code]. window.document.write just shows text without styling","The sentence """""" window.document.write just shows text without styling """""" uses <pattern>just shows text without styling</pattern> to indicate that the user is experiencing an undesired behavior where the XML is displayed without styling. The answer is YES.",No sentences found to indicate the error or undesired behavior. The answer is NO.,"The sentence """""" window.document.write just shows text without styling """""" uses <pattern>just shows text without styling</pattern> to indicate that the user is experiencing an undesired behavior where the XML content is displayed without styling. The answer is YES.",0,1,0,0,0,1
angular,"Hey, I have a question concerning Injectable's ProvidedIn. [code] > The @Injectable() decorator specifies that Angular can use this class in the DI system. The metadata, providedIn: 'root', means that the HeroService is visible throughout the application. What if I take that away? I thought I had to pass injectables to a component constructors to be able to use them, I'm unclear about this now","The sentence """""" What if I take that away? """""" uses <pattern>take that away</pattern> to indicate that the user is uncertain about the consequence of removing the ""providedIn"" property from the @Injectable decorator. The answer is YES.","The sentence """""" What if I take that away? """""" uses <pattern>take that away</pattern> to indicate that the user is uncertain about removing the providedIn property from the @Injectable decorator. The answer is YES.","The sentence """""" What if I take that away? """""" uses <pattern>take that away</pattern> to indicate that the user is concerned about removing the ""providedIn"" property from the @Injectable() decorator. The answer is YES.",0,0,0,0,0,1
