source,issue,openAI_PS1,openAI_PS2,openAI_PS3,y'1,y'2,y'3,y_PS,y''_PS,ACC_AI_PS
appium,i used two times swipe code in same class that is not working can you help me why it is not working?,"The sentence """""" i used two times swipe code in same class that is not working """""" uses <pattern>is not working</pattern> to indicate that the user is experiencing an error or undesired behavior when trying to use the swipe code multiple times in the same class. The answer is YES.","The sentence """""" i used two times swipe code in same class that is not working """""" uses <pattern>not working</pattern> to indicate that the user is experiencing an error or undesired behavior when using ""two times swipe code in same class"". The answer is YES.","The sentence """""" i used two times swipe code in same class that is not working """""" uses <pattern>not working</pattern> to indicate that the user is experiencing an error or undesired behavior when using the swipe code. The answer is YES.",0,0,0,0,0,1
docker,"hello, being newish to docker i set upon creating a rabbitmq container with docker-compose I have so many questions Hope I good here Am I correct in assuming its database is not preserved between restarts unless i map it to a local volume? Is providing an entrypoint in the docker-compose.yml preventing the entrypoint DockerFile entrypoint from the image from being run? And if, so how do would I add addional runtime configuration, such a user account etc. This image seems to run allright, but I can't seem to define ssl options as it (re)creates its own rabbitmq.config","The sentence """""" Is providing an entrypoint in the docker-compose.yml preventing the entrypoint DockerFile entrypoint from the image from being run? """""" uses <pattern>preventing the entrypoint DockerFile entrypoint from the image from being run</pattern> to indicate that the user is encountering an undesired behavior related to the entrypoint in the Dockerfile and docker-compose.yml. The answer is YES.","The sentence """""" Is providing an entrypoint in the docker-compose.yml preventing the entrypoint DockerFile entrypoint from the image from being run? """""" uses <pattern>preventing the entrypoint DockerFile entrypoint from the image from being run</pattern> to indicate that the user is experiencing an undesired behavior. The answer is YES.","The sentence """""" Is providing an entrypoint in the docker-compose.yml preventing the entrypoint DockerFile entrypoint from the image from being run? """""" uses <pattern>providing an entrypoint</pattern> to indicate that the user is having trouble with the provided entrypoint in the docker-compose.yml file. The answer is YES.",0,0,0,0,0,1
typescript,"I've got a problem when extending a class with a super in constructor. It looks like that when I'm extending an other class (in other package in typescript transpilled to es2015), when compiling my class and using it, I have Class constructor FlexError cannot be invoked without 'new' Here is the class that I'll extend And the extending class The two classes are on separate packages, The first one is published by compiled in es2015 The second one compiles in es2015 fine, but fails at runtime with the error mentioned above","The sentence """""" I have Class constructor FlexError cannot be invoked without 'new' """""" uses <pattern>Class constructor FlexError cannot be invoked without 'new'</pattern> to indicate the error or undesired behavior of the code. The answer is YES.","The sentence """""" I have Class constructor FlexError cannot be invoked without 'new' """""" uses <pattern>Class constructor NN cannot be invoked without 'new'</pattern> to indicate the error or undesired behavior of the code. The answer is YES.","The sentence """""" I have Class constructor FlexError cannot be invoked without 'new' """""" uses <pattern>Class constructor FlexError cannot be invoked without 'new'</pattern> to indicate the error or undesired behavior of the code. The answer is YES.",0,0,0,0,0,1
typescript,"given the following code, is it possible to access the'a2'argument to@decorator('a2') as a type?",No sentences found to indicate the error or undesired behavior. The answer is NO.,No sentences found to indicate the error or undesired behavior. The answer is NO.,No sentences found to indicate the error or undesired behavior. The answer is NO.,1,1,1,1,1,1
appium,"hello, Im having some issues with numeric keyboard in ios I can not make senKeys work",No sentences found to indicate the error or undesired behavior. The answer is NO.,"The sentence """""" Im having some issues with numeric keyboard in ios I can not make senKeys work """""" uses <pattern>can not make NN NNS work</pattern> to indicate that the user is having trouble making ""senKeys work"" with the numeric keyboard in iOS. The answer is YES.","The sentence """""" Im having some issues with numeric keyboard in ios I can not make senKeys work """""" uses <pattern>can not make VB senKeys work</pattern> to indicate that the user is experiencing trouble with making ""senKeys"" work on the numeric keyboard in iOS. The answer is YES.",1,0,0,0,0,1
ethereum,"hi, which part of the keystroke file had to be backuped ? is there any documentation what the different data in this file means ? is it possible to get my private key from the keystroke file ? is able to generate if for me but i would like to do it on my own",No sentences found to indicate the error or undesired behavior. The answer is NO.,No sentences found to indicate the error or undesired behavior. The answer is NO.,No sentences found to indicate the error or undesired behavior. The answer is NO.,1,1,1,1,1,1
docker,Hi all. I'm trying to setup a compose file for wordpress/mysql and keep getting the error timcharper: the wordpress docs states-e WORDPRESS_DB_HOST=... (defaults to the IP and port of the linked mysql container)as far asMYSQL_PORT_3306_TCPI did not see any documentation on either image,No sentences found to indicate the error or undesired behavior. The answer is NO.,No sentences found to indicate the error or undesired behavior. The answer is NO.,No sentences found to indicate the error or undesired behavior. The answer is NO.,1,1,1,0,1,0
appium,"hi... i have problem with appium driver FindElement, suddenly it runs so slow. tried different version of selenium driver and it doest fixed my issues any one can help me? thanks alot","The sentence """""" it runs so slow """""" uses <pattern>runs so slow</pattern> to indicate that the ""appium driver FindElement"" is running slowly. The answer is YES.","The sentence """""" suddenly it runs so slow."""""" uses <pattern>runs so slow</pattern> to indicate that the ""appium driver FindElement"" is running slow. The answer is YES.","The sentence """""" i have problem with appium driver FindElement, suddenly it runs so slow. """""" uses <pattern>runs so slow</pattern> to indicate that the user is experiencing a slow performance issue with the appium driver's FindElement functionality. The answer is YES.",0,0,0,0,0,1
appium,Hi guys. I'm setting Appium up for the first time and am running into an issue. Setting up ANDROID_HOME doesn't seem to be working correctly. When I run echo $ANDROID_HOME I get android sdk root. Please see my Bash below and inform me if you see anything incorrect,"The sentence """""" Setting up ANDROID_HOME doesn't seem to be working correctly. """""" uses <pattern>doesn't seem to be working correctly</pattern> to indicate that ""Setting up ANDROID_HOME"" is not functioning as expected. The answer is YES.",No sentences found to indicate the error or undesired behavior. The answer is NO.,"The sentence """""" Setting up ANDROID_HOME doesn't seem to be working correctly. """""" uses <pattern>doesn't seem to be working correctly</pattern> to indicate that ""Setting up ANDROID_HOME"" is causing an error or undesired behavior. The answer is YES.",0,1,0,0,0,1
nodejs,"Hey guys. I have a question which couldn't get answered in other room. Can someone tell if, is it worth it to learn MEAN in 2017? (Want to learn it badly, just not sure if it's reasonable) shivkumarsingh7: so, in other words, it's still worth and no reason to not do so?",No sentences found to indicate the error or undesired behavior. The answer is NO.,No sentences found to indicate the error or undesired behavior. The answer is NO.,No sentences found to indicate the error or undesired behavior. The answer is NO.,1,1,1,1,1,1
nodejs,"Okay, When I run my electron program I get the following error:Failed to load gRPC binary module because it was not installed for the current system. Any ideas?","The sentence """""" Failed to load gRPC binary module because it was not installed for the current system. """""" uses <pattern>Failed to load JJ NN NN because it was not installed for the current system</pattern> to indicate the error or undesired behavior of the system. The answer is YES.","The sentence """""" Failed to load gRPC binary module because it was not installed for the current system. """""" uses <pattern>Failed to load NN JJ NNS because it was not installed for the current system.</pattern> to indicate that the error is ""Failed to load gRPC binary module because it was not installed for the current system"". The answer is YES.","The sentence """"""Failed to load gRPC binary module because it was not installed for the current system."""""" uses <pattern>Failed to load JJ NN NN because</pattern> to indicate the error or undesired behavior of the system. The answer is YES.",0,0,0,0,0,1
appium,i am not very sure if the file should already be there on the given location or should i copy it from some where ?,No sentences found to indicate the error or undesired behavior. The answer is NO.,No sentences found to indicate the error or undesired behavior. The answer is NO.,No sentences found to indicate the error or undesired behavior. The answer is NO.,1,1,1,1,1,1
appium,"Hi guys, im planning to use appium to automate chrome in android. I was wondering is there any possibility of appium detected as bot by websites? I know selenium leaves traces, is that same case for appium? Thanks",No sentences found to indicate the error or undesired behavior. The answer is NO.,"The sentence """""" I was wondering is there any possibility of appium detected as bot by websites? """""" uses <pattern>possibility of JJ NN detected as NN by NN</pattern> to indicate that the user is concerned about the possibility of ""appium detected as bot by websites"". The answer is YES.","The sentence """""" I was wondering is there any possibility of appium detected as bot by websites? """""" uses <pattern>possibility of detected as bot by websites</pattern> to indicate the user's concern about whether Appium could be detected as a bot by websites. The answer is YES.",1,0,0,1,0,0
docker,"hi folks, I am new to using docker and I have a chicken-and-egg problem. Mydocker build -t myproject .command requires access to postgres, because I am generating code based on postgres schemas however, it looks like if I set that up usingdocker-compose.yml, it needs to be published. For it to be published, it needs to be built What am I missing here? I think I can't do the latter, because the schema is managed via migrations and is subject to change could you clarify the first sentence?",No sentences found to indicate the error or undesired behavior. The answer is NO.,No sentences found to indicate the error or undesired behavior. The answer is NO.,No sentences found to indicate the error or undesired behavior. The answer is NO.,1,1,1,1,1,1
gitter,"hiya folks. is there a reason dark mode for the android app does not extend to the actual chat? MadLittleMods: submitted so, whenever i get a notification, i get a system message that ""Gitter has stopped"" is that a feature","The sentence """""" whenever i get a notification, i get a system message that ""Gitter has stopped"" """""" uses <pattern>i get a system message that VBZ VBG</pattern> to indicate that the user is experiencing a system message indicating that ""Gitter has stopped"" when they receive a notification. The answer is YES.","The sentence """""" is there a reason dark mode for the android app does not extend to the actual chat? """""" uses <pattern>does not extend to</pattern> to indicate that the dark mode for the android app should extend to the actual chat. The answer is YES.","The sentence """""" is that a feature """""" uses <pattern>is that a feature</pattern> to indicate that the user is asking if the behavior of ""getting a system message that 'Gitter has stopped'"" is intentional or a desired feature. The answer is NO.",0,0,1,0,0,1
docker,Is there someone that set up a node container by connecting mongo on main host ?,No sentences found to indicate the error or undesired behavior. The answer is NO.,No sentences found to indicate the error or undesired behavior. The answer is NO.,No sentences found to indicate the error or undesired behavior. The answer is NO.,1,1,1,1,1,1
deeplearning4j,"Anyone can explain me why there is such a variation in model scores? Sometimes it starts at 12, other times 3, or even 0.10..","The sentence """"""Sometimes it starts at 12, other times 3, or even 0.10.."""""" uses <pattern>starts at CD, other times CD, or even CD</pattern> to indicate that there is a variation in the model scores. The answer is YES.","The sentence """""" Anyone can explain me why there is such a variation in model scores? """""" uses <pattern>such a variation in NNS</pattern> to indicate that the user is experiencing an undesired behavior of ""variation in model scores"". The answer is YES.","The sentence """""" Anyone can explain me why there is such a variation in model scores? """""" uses <pattern>such a variation in model scores</pattern> to indicate that the user is experiencing a variation in the scores of a model. The answer is YES.",0,0,0,0,0,1
docker,anyone can help me? new to docker cannot run an instance of strapi says module not found :o,No sentences found to indicate the error or undesired behavior. The answer is NO.,"The sentence """""" says module not found :o """""" uses <pattern>says module not found</pattern> to indicate the error or undesired behavior of the system or code provided by the user. The answer is YES.","The sentence """""" cannot run an instance of strapi says module not found :o """""" uses <pattern>says module not found</pattern> to indicate that the user is encountering an error where a module is not found while trying to run an instance of Strapi. The answer is YES.",1,0,0,0,0,1
deeplearning4j,"guys, I'm doing some testing about the spark bug i'm facing. I just found out that if I do not specify any of --executor-memory or --driver-memory (so spark uses 1g per executor), the training works fine. Can this mean that dl4j needs a lot of memory for itself even in training with spark?","The sentence """""" if I do not specify any of --executor-memory or --driver-memory (so spark uses 1g per executor), the training works fine. """""" uses <pattern>training works fine</pattern> to indicate that the user is experiencing a bug with Spark. The answer is YES.",No sentences found to indicate the error or undesired behavior. The answer is NO.,No sentences found to indicate the error or undesired behavior. The answer is NO.,0,1,1,1,1,1
deeplearning4j,"hi, in nd4j-examples I see only basic usage examples, I want to know if I can do a PR with a standard logistic regression implementation or if it is not the right place",No sentences found to indicate the error or undesired behavior. The answer is NO.,No sentences found to indicate the error or undesired behavior. The answer is NO.,No sentences found to indicate the error or undesired behavior. The answer is NO.,1,1,1,1,1,1
docker,Hi i have pulled an new postgres on the already exisiting one and when i tired to start the new postgerss docker deamon is giving error. Error response from daemon: Cannot start container postgres: Error getting container from driver aufs: error creating aufs mount to: invalid argument can any one help me with this ?,"The sentence """""" Error response from daemon: Cannot start container postgres: Error getting container from driver aufs: error creating aufs mount to: invalid argument """""" uses <pattern>error creating aufs mount to: invalid argument</pattern> to indicate the error or undesired behavior of the system or code provided by the user. The answer is YES.",No sentences found to indicate the error or undesired behavior. The answer is NO.,"The sentence """""" Error response from daemon: Cannot start container postgres: Error getting container from driver aufs: error creating aufs mount to: invalid argument """""" uses <pattern>error creating JJ NNS to: invalid argument</pattern> to indicate the error or undesired behavior of the system or code provided by the user. The answer is YES.",0,1,0,0,0,1
gitter,"Question regarding third-party permissions with GitHub and Gitter. If I transition an organization from ""no restrictions"" to ""restricting 3rd party access"", will there be any unforeseen issues or outages? Is it as simple as approving Gitter once again? I've referred to but it only addresses the initial setup of Gitter community, not transitioning OAuth permissions.",No sentences found to indicate the error or undesired behavior. The answer is NO.,"The sentence """""" will there be any unforeseen issues or outages? """""" uses <pattern>unforeseen issues or outages</pattern> to indicate that the user is concerned about the potential problems or disruptions when transitioning OAuth permissions. The answer is YES.","The sentence """""" If I transition an organization from ""no restrictions"" to ""restricting 3rd party access"", will there be any unforeseen issues or outages? """""" uses <pattern>unforeseen issues or outages</pattern> to indicate the user's concern about potential issues or outages when transitioning the organization's permissions. The answer is YES.",1,0,0,0,0,1
ethereum,ETH and ERC20 tokens Txs still slow? I hevnt been able to move any of my ERC20 tokens out of exchanges .,"The sentence """""" I hevnt been able to move any of my ERC20 tokens out of exchanges . """""" uses <pattern>hevnt been able to move any of my ERC20 tokens out of exchanges</pattern> to indicate the undesired behavior of not being able to move ERC20 tokens out of exchanges. The answer is YES.","The sentence """""" I hevnt been able to move any of my ERC20 tokens out of exchanges """""" uses <pattern>haven't been able to move any of my ERC20 tokens out of exchanges</pattern> to indicate that the user is experiencing an undesirable situation where they are unable to move their ERC20 tokens out of exchanges. The answer is YES.","The sentence """""" I hevnt been able to move any of my ERC20 tokens out of exchanges """""" uses <pattern>haven't been able to move any of my ERC20 tokens out of exchanges</pattern> to indicate that the user is experiencing difficulty in ""moving ERC20 tokens out of exchanges"". The answer is YES.",0,0,0,0,0,1
gitter,"I am trying to use hexchat, but I keep getting: No ping reply for 79 seconds, disconnecting. is that something I have to disable on hexchat? using ""/set net_ping_timeout 0"" seems to work","The sentence """""" No ping reply for 79 seconds, disconnecting. """""" uses <pattern>No ping reply for NUM seconds</pattern> to indicate that the error is ""No ping reply for 79 seconds"". The answer is YES.","The sentence """""" No ping reply for 79 seconds, disconnecting. """""" uses <pattern>No ping reply for NN seconds</pattern> to indicate the error or undesired behavior of ""disconnecting"". The answer is YES.","The sentence """""" I keep getting: No ping reply for 79 seconds, disconnecting. """""" uses <pattern>No ping reply for NN seconds</pattern> to indicate the error or undesired behavior of ""getting disconnected due to no ping reply"". The answer is YES.",0,0,0,0,0,1
nodejs,"Hello, I would like to use typescript with node. I read tutorials using gulp to compile typescript files into javascript files in a separate folder (often dist). But in , I don't see any javascript files compiled. I don't understand the difference. Or maybe there are .js but I can't see them?","The sentence """""" But in , I don't see any javascript files compiled. """""" uses <pattern>I don't see any JJ NNS compiled</pattern> to indicate that the user is experiencing an error or undesired behavior of not being able to see any compiled JavaScript files. The answer is YES.","The sentence """""" But in , I don't see any javascript files compiled. """""" uses <pattern>don't see any JJ NNS compiled</pattern> to indicate that the user is expecting to see compiled javascript files but they are not visible. The answer is YES.","The sentence """""" But in , I don't see any javascript files compiled. """""" uses <pattern>I don't see any NNS</pattern> to indicate that the user is not seeing any compiled JavaScript files. The answer is YES.",0,0,0,0,0,1
deeplearning4j,"Hi guys ! I have a short question and hope that someone can help me: whenever I try to train my CNN for a binary classification problem - I get the following message : ""1 class was never predicted by the model and was excluded from average precision."" after the evaluationI created a small dataset for training purpose which contains around 4900 pictures per class. So I tried different things to pass the data - at the moment it looks like this.","The sentence """""" ""1 class was never predicted by the model and was excluded from average precision."" """""" uses <pattern>class was never predicted</pattern> to indicate that ""1 class"" is never predicted by the model. The answer is YES.","The sentence """""" ""1 class was never predicted by the model and was excluded from average precision."" after the evaluation """""" uses <pattern>was never predicted by the model</pattern> to indicate the error or undesired behavior. The answer is YES.","The sentence """""" ""1 class was never predicted by the model and was excluded from average precision."" """""" uses <pattern>1 class was never predicted by the model</pattern> to indicate that the error or undesired behavior is that ""1 class was never predicted by the model and was excluded from average precision."" The answer is YES.",0,0,0,0,0,1
deeplearning4j,im using Image Transform to in this code but transformed image not show what's wrong ? =)),"The sentence """""" transformed image not show """""" uses <pattern>transformed image not show</pattern> to indicate that the transformed image is not being displayed. The answer is YES.","The sentence """""" transformed image not show """""" uses <pattern>transformed image not show</pattern> to indicate that the transformed image is not being displayed. The answer is YES.",No sentences found to indicate the error or undesired behavior. The answer is NO.,0,0,1,0,0,1
deeplearning4j,"In ParagraphVectorsClassifierExample , i got same value for all iteration - "" o.d.m.s.SequenceVectors - Epoch: [2]; Words vectorized so far: [7590]; Lines vectorized so far: [30]; learningRate: [0.001]"" . Is this expected?","The sentence """""" In ParagraphVectorsClassifierExample , i got same value for all iteration - "" o.d.m.s.SequenceVectors - Epoch: [2]; Words vectorized so far: [7590]; Lines vectorized so far: [30]; learningRate: [0.001]"" """""" uses <pattern>same value for all iteration</pattern> to indicate that ""getting the same value for all iteration"" is an undesired behavior. The answer is YES.",No sentences found to indicate the error or undesired behavior. The answer is NO.,"The sentence """""" i got same value for all iteration - "" o.d.m.s.SequenceVectors - Epoch: [2]; Words vectorized so far: [7590]; Lines vectorized so far: [30]; learningRate: [0.001]"" """""" uses <pattern>got same value for all iteration</pattern> to indicate that getting the same value for all iterations is an undesired behavior. The answer is YES.",0,1,0,0,0,1
appium,Hi everyone i need a help from u all getting this error while try to run the WDA in xcode,No sentences found to indicate the error or undesired behavior. The answer is NO.,No sentences found to indicate the error or undesired behavior. The answer is NO.,No sentences found to indicate the error or undesired behavior. The answer is NO.,1,1,1,0,1,0
appium,"Getting http host connection exception while running Android on Windows.Appium version: 1.4.16 Android version: 6.0 Windows 7. After some test case it automatically coming in the logs.Anyone have the idea on this error? Actual Error: failed: Connection refused: priyankshah217: I tried on four systems, only on one system am getting this error. Others it working. Anything specific to it. On that system, installed Anti-virus. Anything related to adb or SDK version?","The sentence """""" Getting http host connection exception while running Android on Windows. """""" uses <pattern>Getting http host connection exception</pattern> to indicate the error or undesired behavior of the system or code provided by the user. The answer is YES.","The sentence """""" Actual Error: failed: Connection refused: priyankshah217: I tried on four systems, only on one system am getting this error. Others it working. Anything specific to it. On that system, installed Anti-virus. Anything related to adb or SDK version? """""" uses <pattern>am getting this error</pattern> to indicate that the user is experiencing the error of ""failed: Connection refused"" and wants to know if there is anything specific to the system causing this issue. The answer is YES.",No sentences found to indicate the error or undesired behavior. The answer is NO.,0,0,1,0,0,1
