source,issue,openAI_PS1,openAI_PS2,openAI_PS3,y'1,y'2,y'3,y_PS,y''_PS,ACC_AI_PS
,"Hello Guys, Got an issue with Angular route using named outlet. It seems to work just great with unnamed `<router-outlet>` but soon as I name it, it gives me `Cannot match any route: URL segment '...'` I crafted the issue here - [link] Thank you","The sentence """""" it gives me `Cannot match any route: URL segment '...'` """""" uses <pattern>gives me Cannot match any route: URL segment NN NN</pattern> to indicate that the user is getting a ""Cannot match any route"" error when using a named outlet. The answer is YES.","The sentence """""" it gives me `Cannot match any route: URL segment '...'` """""" uses <pattern>Cannot match any route: URL segment '...'</pattern> to indicate that the user is experiencing the error message ""Cannot match any route: URL segment '...'"". The answer is YES.","The sentence """""" it gives me `Cannot match any route: URL segment '...'` """""" uses <pattern>Cannot match any route</pattern> to indicate the error or undesired behavior of ""Angular route using named outlet"". The answer is YES.",0,0,0,0,0,1
,"Hello guys, Why are there no suggestions for events in the html ""(click,...) by using ""Angular Language Service"" (default Ivy) in VS code? When I use View-engine option, than it works. (Angular 12.2.0) Thanks in advance.","The sentence """""" Why are there no suggestions for events in the html ""(click,...) by using ""Angular Language Service"" (default Ivy) in VS code? """""" uses <pattern>no suggestions for events</pattern> to indicate that the user is experiencing a lack of suggestions for events when using the Angular Language Service in VS code. The answer is YES.","The sentence """""" Why are there no suggestions for events in the html ""(click,...) by using ""Angular Language Service"" (default Ivy) in VS code? """""" uses <pattern>no suggestions for events in the html</pattern> to indicate an undesired behavior. The answer is YES.","The sentence """""" Why are there no suggestions for events in the html ""(click,...) by using ""Angular Language Service"" (default Ivy) in VS code? """""" uses <pattern>no suggestions for events in the html</pattern> to indicate that the user is experiencing the undesired behavior of ""no suggestions for events in the html"" when using the ""Angular Language Service"" with default Ivy in VS code. The answer is YES.",0,0,0,0,0,1
angular,"having an issue in a reactive form with it not disabling on startup... [code] inside a formbuilder group. Is there something else I should be doing? I check the breakpoint and it shows the formcontrol status is Disabled but it still is enabled when you click on it. @BertrandMarechal yeah, I think there must be a bug with it. I had to disable it manually in the ngInit method...","The sentence """""" I check the breakpoint and it shows the formcontrol status is Disabled but it still is enabled when you click on it. """""" uses <pattern>formcontrol status is JJ</pattern> to indicate that the issue is with the form control not being disabled even though its status is ""Disabled"". The answer is YES.","The sentence """""" I check the breakpoint and it shows the formcontrol status is Disabled but it still is enabled when you click on it """""" uses <pattern>shows the formcontrol status is Disabled</pattern> to indicate that the form is not being disabled correctly. The answer is YES.","The sentence """""" I check the breakpoint and it shows the formcontrol status is Disabled but it still is enabled when you click on it. """""" uses <pattern>the formcontrol status is Disabled</pattern> to indicate that the form control is not being disabled as expected. The answer is YES.",0,0,0,0,0,1
angular,"Hello everyone, I seem to have a problem with an angular 9 app, that I can't figure out for the life of me. Benn stuck on this for 2 days. My app works fine locally, but when I deploy to my remote tomcat, and I try to access it, I get the following error: core.js:4127 ERROR Error: Uncaught (in promise): TypeError: [file] is not a function at breadcrumb.service.ts:6. thing is, my breadcrumb.service has @Injectable({'...'}), and is in the [providers] of the login module. any input is most welcome, ty in advance","The sentence """""" I get the following error: core.js:4127 ERROR Error: Uncaught (in promise): TypeError: [file] is not a function at breadcrumb.service.ts:6. """""" uses <pattern>is not a function at breadcrumb.service.ts:6</pattern> to indicate the error or undesired behavior of the system or code. The answer is YES.","The sentence """""" I get the following error: core.js:4127 ERROR Error: Uncaught (in promise): TypeError: [file] is not a function at breadcrumb.service.ts:6. """""" uses <pattern>TypeError: [file] is not a function</pattern> to indicate the error or undesired behavior of the system or code provided by the user. The answer is YES.","The sentence """""" I get the following error: core.js:4127 ERROR Error: Uncaught (in promise): TypeError: [file] is not a function at breadcrumb.service.ts:6. """""" uses <pattern>[file] is not a function at breadcrumb.service.ts:6</pattern> to indicate that the user is getting a TypeError regarding a specific file and function in the breadcrumb service. The answer is YES.",0,0,0,0,0,1
angular,"I have node 14 locally. I should try to update incrementally on server, and see if that fixes the issue, maybe not update from 10 to 14, in one go. so I've managed to get past the problem, the issue was apparently that I didn't have my login module in my imports of the main module but I have another error now. for some reason the modules were not lazy loading on prod, I added them all in the parent module","The sentence """""" I have another error now. """""" uses <pattern>another error now</pattern> to indicate that the user is experiencing another error after fixing the previous issue. The answer is YES.","The sentence """""" the issue was apparently that I didn't have my login module in my imports of the main module """""" uses <pattern>didn't have my JJ NN in my imports</pattern> to indicate that the user's error was not having the login module in the imports of the main module. The answer is YES.","The sentence """""" the modules were not lazy loading on prod """""" uses <pattern>were not lazy loading on prod</pattern> to indicate that ""modules were not lazy loading on prod"" is an error or undesired behavior. The answer is YES.",0,0,0,0,0,1
angular,"pls i need help, my ionic project i tried to run ionic build, i got this error [ERROR] ng has unexpectedly closed (exit code 3). i ran npm install [code]. it was to no avail and now i can't even run ionic serve cos it will give me the same error","The sentence """""" i got this error [ERROR] ng has unexpectedly closed (exit code 3). """""" uses <pattern>ng has unexpectedly closed (exit code 3)</pattern> to indicate that ""ng has unexpectedly closed"" is an error or undesired behavior. The answer is YES.","The sentence """""" i got this error [ERROR] ng has unexpectedly closed (exit code 3). """""" uses <pattern>[ERROR] ng has unexpectedly closed (exit code 3)</pattern> to indicate the error or undesired behavior of the system. The answer is YES.","The sentence """""" i got this error [ERROR] ng has unexpectedly closed (exit code 3) """""" uses <pattern>unexpectedly closed</pattern> to indicate that ""ng has unexpectedly closed"" is the error or undesired behavior. The answer is YES.",0,0,0,0,0,1
angular,"here, I am using angular v12, and I suddenly ran into an error while trying to run my unit test: Error: error TS2307: Cannot find module './input.component' or its corresponding type declarations. I believe this has something to do with the tsconfig.json specifications. I tried ""include"": [""src/***/*.ts""] but still the same error. Any immediate help is appreciated as i am unable to proceed further!!","The sentence """""" Error: error TS2307: Cannot find module './input.component' or its corresponding type declarations. """""" uses <pattern>Cannot find module NOUN or its corresponding type declarations</pattern> to indicate the error or undesired behavior of the system. The answer is YES.","The sentence """""" Error: error TS2307: Cannot find module './input.component' or its corresponding type declarations. """""" uses <pattern>Cannot find module NOUN</pattern> to indicate the error or undesired behavior of the system or code. The answer is YES.","The sentence """""" Error: error TS2307: Cannot find module './input.component' or its corresponding type declarations. """""" uses <pattern>Cannot find module</pattern> to indicate the error of ""Cannot find module './input.component' or its corresponding type declarations"". The answer is YES.",0,0,0,0,0,1
angular,"Hi. I'm a little confused about attr.attr-name template syntax. Is attr.attr-name allowed without square brackets? Stackblitz illustrating my confusion: [link]. More context: I'm trying to localize an interpolated aria-label -- something like [code] -- but it's not showing up in my .xlf file, so I'm working backward through assumptions to see what I'm misunderstanding, or if there's a bug somewhere. [code] is rejected by the compiler, which is why I'm using attr syntax to begin with.","The sentence """""" [code] is rejected by the compiler, which is why I'm using attr syntax to begin with. """""" uses <pattern>rejected by the compiler</pattern> to indicate that ""[code]"" is causing an error when compiling. The answer is YES.","The sentence """""" [code] is rejected by the compiler, which is why I'm using attr syntax to begin with. """""" uses <pattern>is rejected by the compiler</pattern> to indicate that ""[code] is rejected by the compiler"" is an undesired behavior. The answer is YES.","The sentence """""" [code] is rejected by the compiler, which is why I'm using attr syntax to begin with. """""" uses <pattern>is rejected by the compiler</pattern> to indicate that the user is experiencing an error where ""[code] is rejected by the compiler"". The answer is YES.",0,0,0,0,0,1
,Having an issue with Angular where it is not updating the form validation properly after changing a value to an empty string or null. I use updateValueAndValidity but it still shows the control and form is valid. Any thoughts? formcontrol value has been tested with an empty string and null and both still show as valid.,"The sentence """""" it is not updating the form validation properly after changing a value to an empty string or null """""" uses <pattern>not updating the form validation properly</pattern> to indicate the error or undesired behavior. The answer is YES.","The sentence """""" where it is not updating the form validation properly after changing a value to an empty string or null """""" uses <pattern>not updating the form validation properly</pattern> to indicate that the ""form validation"" is not behaving as expected. The answer is YES.","The sentence """""" Having an issue with Angular where it is not updating the form validation properly after changing a value to an empty string or null. """""" uses <pattern>not updating the form validation properly</pattern> to indicate the error or undesired behavior. The answer is YES.",0,0,0,0,0,1
angular,"Hello, does anyone have an idea why this error is happening? An unhandled exception occurred: No provider for InjectionToken ng.v5.stylesheetProcessor! I am trying to build my app and I get the error above. I recently updated to angular 11","The sentence """""" An unhandled exception occurred: No provider for InjectionToken ng.v5.stylesheetProcessor! """""" uses <pattern>No provider JJ for NN</pattern> to indicate the error ""No provider for InjectionToken ng.v5.stylesheetProcessor!"". The answer is YES.","The sentence """""" An unhandled exception occurred: No provider for InjectionToken ng.v5.stylesheetProcessor! """""" uses <pattern>No provider for InjectionToken JJ</pattern> to indicate that the error ""No provider for InjectionToken ng.v5.stylesheetProcessor!"" is happening. The answer is YES.","The sentence """""" An unhandled exception occurred: No provider for InjectionToken ng.v5.stylesheetProcessor! """""" uses <pattern>No provider for InjectionToken NOUN</pattern> to indicate that the error ""No provider for InjectionToken ng.v5.stylesheetProcessor!"" is happening. The answer is YES.",0,0,0,0,0,1
typescript,"Hey all, anyone got this error using generator functions with typescript 2.9.1 version.example:",No sentences found to indicate the error or undesired behavior. The answer is NO.,No sentences found to indicate the error or undesired behavior. The answer is NO.,No sentences found to indicate the error or undesired behavior. The answer is NO.,1,1,1,0,1,0
gitter,hrm what is this Gitter User Prod that want to access to my gitlab ?,No sentences found to indicate the error or undesired behavior. The answer is NO.,No sentences found to indicate the error or undesired behavior. The answer is NO.,No sentences found to indicate the error or undesired behavior. The answer is NO.,1,1,1,1,1,1
gitter,how do you uninstall this app? I only want to use it when I'm on my browser,No sentences found to indicate the error or undesired behavior. The answer is NO.,No sentences found to indicate the error or undesired behavior. The answer is NO.,No sentences found to indicate the error or undesired behavior. The answer is NO.,1,1,1,1,1,1
ethereum,"hello I am facing the error while publishing solidity tutorial code on remix:Failed to publish metadata file to swarm, please check the Swarm gateways is available ( swarm-gateways.net ).{""statusCode"":0} please help. Do I need to install Swarm or some swarm tool first for ublishing it or we cannot publish from remix. I am new to this so may be sound crazy somewhere.. what is ico??","The sentence """""" Failed to publish metadata file to swarm, please check the Swarm gateways is available ( swarm-gateways.net ).{""statusCode"":0} """""" uses <pattern>Failed to publish metadata file to swarm, please check the Swarm gateways is available</pattern> to indicate the error or undesired behavior of the system. The answer is YES.","The sentence """""" Failed to publish metadata file to swarm, please check the Swarm gateways is available ( swarm-gateways.net ).{""statusCode"":0} please help. """""" uses <pattern>Failed to publish metadata file to swarm</pattern> to indicate that the user is encountering an error while publishing the code. The answer is YES.","The sentence """""" Failed to publish metadata file to swarm, please check the Swarm gateways is available ( swarm-gateways.net ).{""statusCode"":0} """""" uses <pattern>Failed to publish JJ NN file to NN</pattern> to indicate the error or undesired behavior of ""Failed to publish metadata file to swarm"". The answer is YES.",0,0,0,0,0,1
deeplearning4j,"Error:(26, 13) Failed to resolve: org.nd4j:nd4j-x86:0.4-rc3.9-SNAPSHOT I was trying to run DL4J-Android example.other compiles have been downloaded,except this,why?compile('org.nd4j:nd4j-x86:0.4-rc3.9-SNAPSHOT') is anythis changed?","The sentence """""" Error:(26, 13) Failed to resolve: org.nd4j:nd4j-x86:0.4-rc3.9-SNAPSHOT """""" uses <pattern>Failed to resolve: JJ NN:JJ:JJ</pattern> to indicate that there is an error in resolving the dependency ""org.nd4j:nd4j-x86:0.4-rc3.9-SNAPSHOT"". The answer is YES.","The sentence """""" Error:(26, 13) Failed to resolve: org.nd4j:nd4j-x86:0.4-rc3.9-SNAPSHOT """""" uses <pattern>Failed to resolve: org.nd4j:nd4j-x86:0.4-rc3.9-SNAPSHOT</pattern> to indicate the error or undesired behavior of the code. The answer is YES.","The sentence """""" Error:(26, 13) Failed to resolve: org.nd4j:nd4j-x86:0.4-rc3.9-SNAPSHOT """""" uses <pattern>Failed to resolve JJ NN</pattern> to indicate that the error or undesired behavior is ""Failed to resolve: org.nd4j:nd4j-x86:0.4-rc3.9-SNAPSHOT"". The answer is YES.",0,0,0,0,0,1
typescript,"I'm having trouble with union types and promise, can someone check that I am doing it right? (sorry can't get the url formatter working) just an example. In my real code sometimes it will return a promise and sometimes it will return a boolean",No sentences found to indicate the error or undesired behavior. The answer is NO.,"The sentence """""" I'm having trouble with union types and promise """""" uses <pattern>having trouble with JJ NNS and NNS</pattern> to indicate that the user is experiencing difficulties with ""union types and promise"". The answer is YES.","The sentence """""" I'm having trouble with union types and promise """""" uses <pattern>having trouble with</pattern> to indicate that the user is experiencing trouble with ""union types and promise"". The answer is YES.",1,0,0,0,0,1
deeplearning4j,"How do you guys remote train your java models? I do not have a powerful enough laptop. If it was python, I would simply fire up a jupyter notebook in an AWS instance. What is the equivalent to Java (DL4J)?",No sentences found to indicate the error or undesired behavior. The answer is NO.,"The sentence """""" I do not have a powerful enough laptop. """""" uses <pattern>do not have</pattern> to indicate that the user's current laptop is not powerful enough. The answer is YES.","The sentence """""" I do not have a powerful enough laptop. """""" uses <pattern>do not have enough JJ NN</pattern> to indicate that the user is facing the error or undesired behavior of not having a powerful enough laptop for remote training Java models. The answer is YES.",1,0,0,0,0,1
nodejs,Am I missing which line of my code triggered this stack trace? Can't find which line ismycode: bugger. I grepped all myinsertandupdateobjects and I can't find anything that I've just passed in unsanitized.,"The sentence """""" Can't find which line ismycode: bugger. """""" uses <pattern>Can't find which line</pattern> to indicate that the user is having trouble locating the line of their code that triggered the stack trace. The answer is YES.","The sentence """""" Am I missing which line of my code triggered this stack trace? """""" uses <pattern>missing which line of my code triggered this stack trace</pattern> to indicate that the user is having trouble finding the line of code that caused the stack trace. The answer is YES.",No sentences found to indicate the error or undesired behavior. The answer is NO.,0,0,1,0,0,1
deeplearning4j,"Hi,INDArray Omega = InvertMatrix.invert(Sigma, false);fails ifSigmais of size (1,1) with the following error: Is this expected?","The sentence """""" fails if Sigma is of size (1,1) with the following error: """""" uses <pattern>fails if <noun phrase> with the following error</pattern> to indicate that the code fails when ""Sigma is of size (1,1)"". The answer is YES.","The sentence """""" fails ifSigmais of size (1,1) with the following error: """""" uses <pattern>fails if JJ NNS VBZ of IN size (1,1) with the following error</pattern> to indicate that the code is failing when the size of Sigma is (1,1). The answer is YES.","The sentence """""" INDArray Omega = InvertMatrix.invert(Sigma, false); fails if Sigma is of size (1,1) with the following error: """""" uses <pattern>fails if NP is of size NP with the following error:</pattern> to indicate that the code fails when ""Sigma is of size (1,1)"" with the specified error. The answer is YES.",0,0,0,0,0,1
docker,"hey, so I've noticed that when idocker runeverything goes fine - but when I actually visit the webserver on my host browser the container exits after the first page load is this expected? I'd like the container to be persistent I'm running with","The sentence """""" when I actually visit the webserver on my host browser the container exits after the first page load """""" uses <pattern>container exits after the first page load</pattern> to indicate that the ""container exits after the first page load"" is an undesired behavior. The answer is YES.","The sentence """""" but when I actually visit the webserver on my host browser the container exits after the first page load is this expected? """""" uses <pattern>the container exits after the first page load</pattern> to indicate that the container exiting after the first page load is an undesired behavior. The answer is YES.","The sentence """""" but when I actually visit the webserver on my host browser the container exits after the first page load is this expected? """""" uses <pattern>the container exits after the first page load</pattern> to indicate an undesired behavior. The answer is YES.",0,0,0,0,0,1
deeplearning4j,"Ok, one question on RNNs. If I have my DataSet ready for simple feed-forward net, what do i need to change to plug in LSTMLayer + RnnOutputLayer? Is it just change in the configuration of the model, or do I need to change how data is fed to it as well? Ok it's 100, and I have 10000 samples Is there an abstraction that will turn my 2d DataSet into 3d DataSet for RNN?",No sentences found to indicate the error or undesired behavior. The answer is NO.,No sentences found to indicate the error or undesired behavior. The answer is NO.,"The sentence """""" If I have my DataSet ready for simple feed-forward net, what do i need to change to plug in LSTMLayer + RnnOutputLayer? """""" uses <pattern>what do i need to change to</pattern> to indicate that the user is asking for guidance on how to modify their code to incorporate LSTMLayer and RnnOutputLayer. The answer is YES.",1,1,0,1,1,1
gitter,"Is it just me, or does the welcome message keep changing?",No sentences found to indicate the error or undesired behavior. The answer is NO.,No sentences found to indicate the error or undesired behavior. The answer is NO.,No sentences found to indicate the error or undesired behavior. The answer is NO.,1,1,1,1,1,1
ethereum,can I use ethereum to make an application which is not related to cryptocurrency?,No sentences found to indicate the error or undesired behavior. The answer is NO.,No sentences found to indicate the error or undesired behavior. The answer is NO.,No sentences found to indicate the error or undesired behavior. The answer is NO.,1,1,1,1,1,1
nodejs,"could not able to send email using nodeMailer I am getting this Error { AuthError: Invalid login - 535 Incorrect authentication data at SMTPClient. name: 'AuthError', data: '535 Incorrect authentication data', stage: 'auth' }events.js:112 throw er; please anyone help me to solve this issue arun-awnics: yes I am providing correct User name and Password I couldn't get any idea why i am facing this errror arun-awnics: In my code my email credentials is there","The sentence """""" I am getting this Error { AuthError: Invalid login - 535 Incorrect authentication data at SMTPClient. name: 'AuthError', data: '535 Incorrect authentication data', stage: 'auth' } """""" uses <pattern>Invalid login - 535 Incorrect authentication data</pattern> to indicate the error or undesired behavior of ""could not able to send email using nodeMailer"". The answer is YES.","The sentence """""" Invalid login - 535 Incorrect authentication data """""" uses <pattern>Invalid login - 535 Incorrect authentication data</pattern> to indicate the error or undesired behavior of ""could not able to send email using nodeMailer"". The answer is YES.","The sentence """""" I am getting this Error { AuthError: Invalid login - 535 Incorrect authentication data at SMTPClient. name: 'AuthError', data: '535 Incorrect authentication data', stage: 'auth' }"""""" uses <pattern>Invalid login - 535 Incorrect authentication data</pattern> to indicate the error or undesired behavior of ""could not able to send email using nodeMailer"". The answer is YES.",0,0,0,0,0,1
appium,hi all! When I try run test in real iOS device I'm getting error:selenium.common.exceptions.WebDriverException: Message: An unknown server-side error occurred while processing the command. Original error: simctl error running 'create': Invalid device type: charliebut device connected and available for inspector mgmanikandan87,"The sentence """""" I'm getting error:selenium.common.exceptions.WebDriverException: Message: An unknown server-side error occurred while processing the command. Original error: simctl error running 'create': Invalid device type: charliebut device connected and available for inspector mgmanikandan87 """""" uses <pattern>An unknown server-side error occurred while processing the command</pattern> to indicate the user is encountering an error while running the test on a real iOS device. The answer is YES.","The sentence """""" I'm getting error:selenium.common.exceptions.WebDriverException: Message: An unknown server-side error occurred while processing the command. Original error: simctl error running 'create': Invalid device type: charliebut device connected and available for inspector mgmanikandan87 """""" uses <pattern>I'm getting error:</pattern> to indicate that the user is experiencing an error. The answer is YES.",No sentences found to indicate the error or undesired behavior. The answer is NO.,0,0,1,0,0,1
docker,Is there a way to set password on a docker deployment?,No sentences found to indicate the error or undesired behavior. The answer is NO.,No sentences found to indicate the error or undesired behavior. The answer is NO.,No sentences found to indicate the error or undesired behavior. The answer is NO.,1,1,1,1,1,1
docker,Is anyone here using Rancher currently?,No sentences found to indicate the error or undesired behavior. The answer is NO.,No sentences found to indicate the error or undesired behavior. The answer is NO.,No sentences found to indicate the error or undesired behavior. The answer is NO.,1,1,1,1,1,1
